session_id,interaction_number,move_number,timestamp,micro_timestamp,content,phase,move_type,modality,source,cognitive_load,context
4c7025ad-a1ab-4e20-a9e9-dad89fc9ac28,1,1,2025-08-03T17:49:26.383916,1754261366.383916,I have a site in an urban neighborhood.,unknown,general,text,student,0.032,"{""sentence_position"": 0, ""text_length"": 39, ""has_question"": false, ""word_count"": 8, ""complexity_score"": 0.4}"
4c7025ad-a1ab-4e20-a9e9-dad89fc9ac28,1,2,2025-08-03T17:49:26.483916,1754261366.483916,What should I consider for my community center?,unknown,analysis,text,student,0.044000000000000004,"{""sentence_position"": 1, ""text_length"": 47, ""has_question"": true, ""word_count"": 8, ""complexity_score"": 0.5}"
4c7025ad-a1ab-4e20-a9e9-dad89fc9ac28,1,1,2025-08-03T17:49:26.583916,1754261366.583916,"Hello there,",unknown,general,text,agent,0.013000000000000001,"{""sentence_position"": 0, ""text_length"": 12, ""has_question"": false, ""word_count"": 2, ""complexity_score"": 0.65}"
4c7025ad-a1ab-4e20-a9e9-dad89fc9ac28,1,2,2025-08-03T17:49:26.683916,1754261366.683916,It's fabulous that you're diving into creating a community center in an urban neighborhood.,unknown,general,text,agent,0.07800000000000001,"{""sentence_position"": 1, ""text_length"": 91, ""has_question"": false, ""word_count"": 14, ""complexity_score"": 0.5571428571428572}"
4c7025ad-a1ab-4e20-a9e9-dad89fc9ac28,1,3,2025-08-03T17:49:26.783916,1754261366.783916,This offers such an exciting opportunity to create a space that can truly enhance the community's daily life!,unknown,general,text,agent,0.092,"{""sentence_position"": 2, ""text_length"": 109, ""has_question"": false, ""word_count"": 18, ""complexity_score"": 0.5111111111111111}"
4c7025ad-a1ab-4e20-a9e9-dad89fc9ac28,1,4,2025-08-03T17:49:26.883916,1754261366.883916,"To start, we might want to consider the specific needs and habits of the community.",unknown,analysis,text,agent,0.0924,"{""sentence_position"": 3, ""text_length"": 83, ""has_question"": false, ""word_count"": 15, ""complexity_score"": 0.5599999999999999}"
4c7025ad-a1ab-4e20-a9e9-dad89fc9ac28,1,5,2025-08-03T17:49:26.983916,1754261366.983916,Understanding who we're designing for can help us tailor the center to their needs.,unknown,general,text,agent,0.07,"{""sentence_position"": 4, ""text_length"": 83, ""has_question"": false, ""word_count"": 14, ""complexity_score"": 0.5}"
4c7025ad-a1ab-4e20-a9e9-dad89fc9ac28,1,6,2025-08-03T17:49:27.083916,1754261367.083916,"Additionally, the nature of the urban site presents unique challenges and opportunities, like the existing infrastructure and the landscape.",unknown,general,text,agent,0.16,"{""sentence_position"": 5, ""text_length"": 140, ""has_question"": false, ""word_count"": 19, ""complexity_score"": 0.8421052631578947}"
4c7025ad-a1ab-4e20-a9e9-dad89fc9ac28,1,7,2025-08-03T17:49:27.183916,1754261367.183916,I'm thrilled to accompany you on this journey and see the ideas you'll develop!,unknown,general,text,agent,0.066,"{""sentence_position"": 6, ""text_length"": 79, ""has_question"": false, ""word_count"": 14, ""complexity_score"": 0.4714285714285714}"
4c7025ad-a1ab-4e20-a9e9-dad89fc9ac28,1,8,2025-08-03T17:49:27.283916,1754261367.283916,Could you share a bit more about this community?,unknown,general,text,agent,0.04,"{""sentence_position"": 7, ""text_length"": 48, ""has_question"": true, ""word_count"": 9, ""complexity_score"": 0.4444444444444445}"
4c7025ad-a1ab-4e20-a9e9-dad89fc9ac28,1,9,2025-08-03T17:49:27.383916,1754261367.383916,What are some of the specific challenges you foresee with the urban location?,unknown,general,text,agent,0.065,"{""sentence_position"": 8, ""text_length"": 77, ""has_question"": true, ""word_count"": 13, ""complexity_score"": 0.5}"
4c7025ad-a1ab-4e20-a9e9-dad89fc9ac28,1,10,2025-08-03T17:49:27.483916,1754261367.483916,"To help us explore this together, I'd love to hear your thoughts on:",unknown,general,text,agent,0.095,"{""sentence_position"": 9, ""text_length"": 68, ""has_question"": false, ""word_count"": 13, ""complexity_score"": 0.7307692307692308}"
4c7025ad-a1ab-4e20-a9e9-dad89fc9ac28,1,11,2025-08-03T17:49:27.683916,1754261367.683916,What is the character of the site and surrounding context?,unknown,general,text,agent,0.049,"{""sentence_position"": 11, ""text_length"": 58, ""has_question"": true, ""word_count"": 10, ""complexity_score"": 0.49000000000000005}"
4c7025ad-a1ab-4e20-a9e9-dad89fc9ac28,1,12,2025-08-03T17:49:27.883916,1754261367.883916,How does your design respond to its environment?,unknown,analysis,text,agent,0.0451,"{""sentence_position"": 13, ""text_length"": 48, ""has_question"": true, ""word_count"": 8, ""complexity_score"": 0.5125}"
4c7025ad-a1ab-4e20-a9e9-dad89fc9ac28,1,13,2025-08-03T17:49:28.083916,1754261368.083916,What aspects of the site or context are most important to you?,unknown,general,text,agent,0.051,"{""sentence_position"": 15, ""text_length"": 62, ""has_question"": true, ""word_count"": 12, ""complexity_score"": 0.425}"
4c7025ad-a1ab-4e20-a9e9-dad89fc9ac28,1,14,2025-08-03T17:49:28.183916,1754261368.183916,**How we'll work together:** I'm here to guide you through a progressive learning journey.,unknown,analysis,text,agent,0.1155,"{""sentence_position"": 16, ""text_length"": 90, ""has_question"": false, ""word_count"": 14, ""complexity_score"": 0.75}"
4c7025ad-a1ab-4e20-a9e9-dad89fc9ac28,1,15,2025-08-03T17:49:28.283916,1754261368.283916,"We'll start by understanding your interests and then explore the design space together, building your knowledge step by step.",unknown,general,text,agent,0.126,"{""sentence_position"": 17, ""text_length"": 125, ""has_question"": false, ""word_count"": 19, ""complexity_score"": 0.6631578947368421}"
4c7025ad-a1ab-4e20-a9e9-dad89fc9ac28,1,16,2025-08-03T17:49:28.383916,1754261368.383916,**Next steps:** • Share your thoughts on the questions above • Tell me more about what interests you most • Ask about any concepts you'd like to explore further,unknown,general,text,agent,0.19,"{""sentence_position"": 18, ""text_length"": 160, ""has_question"": false, ""word_count"": 29, ""complexity_score"": 0.6551724137931034}"
4c7025ad-a1ab-4e20-a9e9-dad89fc9ac28,1,17,2025-08-03T17:49:28.483916,1754261368.483916,I'm excited to explore this architectural journey with you!,unknown,general,text,agent,0.051,"{""sentence_position"": 19, ""text_length"": 59, ""has_question"": false, ""word_count"": 9, ""complexity_score"": 0.5666666666666667}"
4c7025ad-a1ab-4e20-a9e9-dad89fc9ac28,1,18,2025-08-03T17:49:28.583916,1754261368.583916,What would you like to start with?,unknown,general,text,agent,0.028000000000000004,"{""sentence_position"": 20, ""text_length"": 34, ""has_question"": true, ""word_count"": 7, ""complexity_score"": 0.4}"
4c7025ad-a1ab-4e20-a9e9-dad89fc9ac28,2,1,2025-08-03T17:50:22.163835,1754261422.163835,"The site is flat with good southern exposure, but it's near a busy intersection.",ideation,general,text,student,0.081,"{""sentence_position"": 0, ""text_length"": 80, ""has_question"": false, ""word_count"": 14, ""complexity_score"": 0.5785714285714285}"
4c7025ad-a1ab-4e20-a9e9-dad89fc9ac28,2,2,2025-08-03T17:50:22.263835,1754261422.263835,How does this affect my design?,ideation,analysis,text,student,0.028599999999999997,"{""sentence_position"": 1, ""text_length"": 31, ""has_question"": true, ""word_count"": 6, ""complexity_score"": 0.4333333333333333}"
4c7025ad-a1ab-4e20-a9e9-dad89fc9ac28,2,1,2025-08-03T17:50:22.363835,1754261422.363835,"When designing a community learning center near a busy intersection, the acoustic environment becomes a critical consideration.",ideation,analysis,text,agent,0.1408,"{""sentence_position"": 0, ""text_length"": 127, ""has_question"": false, ""word_count"": 17, ""complexity_score"": 0.7529411764705882}"
4c7025ad-a1ab-4e20-a9e9-dad89fc9ac28,2,2,2025-08-03T17:50:22.463835,1754261422.463835,"The flat site and good southern exposure offer excellent opportunities for natural light and solar gain, but the proximity to traffic noise introduces challenges that require thoughtful solutions.",ideation,general,text,agent,0.19699999999999998,"{""sentence_position"": 1, ""text_length"": 196, ""has_question"": false, ""word_count"": 28, ""complexity_score"": 0.7035714285714285}"
4c7025ad-a1ab-4e20-a9e9-dad89fc9ac28,2,3,2025-08-03T17:50:22.563835,1754261422.563835,Consider the following perspectives:,ideation,analysis,text,agent,0.044000000000000004,"{""sentence_position"": 2, ""text_length"": 36, ""has_question"": false, ""word_count"": 4, ""complexity_score"": 1.0}"
4c7025ad-a1ab-4e20-a9e9-dad89fc9ac28,2,4,2025-08-03T17:50:22.763835,1754261422.763835,**Acoustic Insulation vs.,ideation,general,text,agent,0.023000000000000003,"{""sentence_position"": 4, ""text_length"": 25, ""has_question"": false, ""word_count"": 3, ""complexity_score"": 0.7666666666666667}"
4c7025ad-a1ab-4e20-a9e9-dad89fc9ac28,2,5,2025-08-03T17:50:22.863835,1754261422.863835,Connection to the Outdoors**: You might think about how to balance the need for soundproofing with the desire to create a connection between indoor and outdoor spaces.,ideation,analysis,text,agent,0.21450000000000005,"{""sentence_position"": 5, ""text_length"": 167, ""has_question"": false, ""word_count"": 27, ""complexity_score"": 0.7222222222222223}"
4c7025ad-a1ab-4e20-a9e9-dad89fc9ac28,2,6,2025-08-03T17:50:22.963835,1754261422.963835,High-performance glazing can reduce noise but might also limit the natural ventilation opportunities.,ideation,general,text,agent,0.08900000000000001,"{""sentence_position"": 6, ""text_length"": 101, ""has_question"": false, ""word_count"": 13, ""complexity_score"": 0.6846153846153846}"
4c7025ad-a1ab-4e20-a9e9-dad89fc9ac28,2,7,2025-08-03T17:50:23.063835,1754261423.063835,How might you design openings or use materials that allow for both quiet interiors and a sense of openness?,ideation,analysis,text,agent,0.09790000000000001,"{""sentence_position"": 7, ""text_length"": 107, ""has_question"": true, ""word_count"": 19, ""complexity_score"": 0.46842105263157896}"
4c7025ad-a1ab-4e20-a9e9-dad89fc9ac28,2,8,2025-08-03T17:50:23.263835,1754261423.263835,**Zoning and Spatial Layout**: Placing quieter spaces like the library or classrooms away from the intersection could mitigate noise issues.,ideation,general,text,agent,0.16099999999999998,"{""sentence_position"": 9, ""text_length"": 140, ""has_question"": false, ""word_count"": 20, ""complexity_score"": 0.8049999999999999}"
4c7025ad-a1ab-4e20-a9e9-dad89fc9ac28,2,9,2025-08-03T17:50:23.363835,1754261423.363835,"Alternatively, you could use buffer zones, such as storage areas or corridors, to shield these spaces.",ideation,general,text,agent,0.135,"{""sentence_position"": 10, ""text_length"": 102, ""has_question"": false, ""word_count"": 16, ""complexity_score"": 0.84375}"
4c7025ad-a1ab-4e20-a9e9-dad89fc9ac28,2,10,2025-08-03T17:50:23.463835,1754261423.463835,How might the layout of your building influence both the acoustic environment and the flow of movement within the center?,ideation,analysis,text,agent,0.11220000000000001,"{""sentence_position"": 11, ""text_length"": 121, ""has_question"": true, ""word_count"": 20, ""complexity_score"": 0.51}"
4c7025ad-a1ab-4e20-a9e9-dad89fc9ac28,2,11,2025-08-03T17:50:23.663835,1754261423.663835,"What aspects of using buffer zones, like storage areas or corridors, to shield quieter spaces from traffic noise do you find most compelling for your community learning center?",ideation,general,text,agent,0.205,"{""sentence_position"": 13, ""text_length"": 176, ""has_question"": true, ""word_count"": 28, ""complexity_score"": 0.7321428571428572}"
4c7025ad-a1ab-4e20-a9e9-dad89fc9ac28,2,12,2025-08-03T17:50:23.763835,1754261423.763835,Why do you think this strategy might be effective in balancing noise reduction and maintaining a smooth flow of movement within your design?,ideation,synthesis,text,agent,0.14159999999999998,"{""sentence_position"": 14, ""text_length"": 140, ""has_question"": true, ""word_count"": 23, ""complexity_score"": 0.5130434782608695}"
4c7025ad-a1ab-4e20-a9e9-dad89fc9ac28,3,1,2025-08-03T17:51:02.422809,1754261462.422809,What are the main opportunities and constraints of this urban site?,ideation,general,text,student,0.057,"{""sentence_position"": 0, ""text_length"": 67, ""has_question"": true, ""word_count"": 11, ""complexity_score"": 0.5181818181818182}"
4c7025ad-a1ab-4e20-a9e9-dad89fc9ac28,3,1,2025-08-03T17:51:02.522809,1754261462.522809,It's great that you're considering the opportunities and constraints of your urban site for the school project.,ideation,analysis,text,agent,0.10450000000000001,"{""sentence_position"": 0, ""text_length"": 111, ""has_question"": false, ""word_count"": 17, ""complexity_score"": 0.5588235294117647}"
4c7025ad-a1ab-4e20-a9e9-dad89fc9ac28,3,2,2025-08-03T17:51:02.622809,1754261462.622809,"Understanding these elements is crucial as they directly influence the design's functionality, sustainability, and connection with the community.",ideation,general,text,agent,0.16399999999999998,"{""sentence_position"": 1, ""text_length"": 145, ""has_question"": false, ""word_count"": 18, ""complexity_score"": 0.911111111111111}"
4c7025ad-a1ab-4e20-a9e9-dad89fc9ac28,3,3,2025-08-03T17:51:02.722809,1754261462.722809,"By diving deeper into this, you can create a space that truly resonates with its users and enhances the neighborhood's fabric.",ideation,general,text,agent,0.127,"{""sentence_position"": 2, ""text_length"": 126, ""has_question"": false, ""word_count"": 21, ""complexity_score"": 0.6047619047619047}"
4c7025ad-a1ab-4e20-a9e9-dad89fc9ac28,3,4,2025-08-03T17:51:02.822809,1754261462.822809,"With this in mind, think about this: How can the site's unique characteristics, such as its natural landscape, existing infrastructure, or community demographics, be leveraged to create a dynamic and inclusive environment that caters to both educational needs and community engagement?",ideation,analysis,text,agent,0.451,"{""sentence_position"": 3, ""text_length"": 285, ""has_question"": true, ""word_count"": 41, ""complexity_score"": 1.0}"
4c7025ad-a1ab-4e20-a9e9-dad89fc9ac28,3,5,2025-08-03T17:51:02.922809,1754261462.922809,Reflecting on this can help you design,ideation,general,text,agent,0.032,"{""sentence_position"": 4, ""text_length"": 38, ""has_question"": false, ""word_count"": 7, ""complexity_score"": 0.45714285714285713}"
4c7025ad-a1ab-4e20-a9e9-dad89fc9ac28,3,6,2025-08-03T17:51:03.022809,1754261463.022809,"What aspects of leveraging the site's natural landscape, existing infrastructure, or community demographics do you find most compelling for creating a dynamic and inclusive environment in your community project, and why do you think these elements will effectively enhance both educational needs and community engagement?",ideation,analysis,text,agent,0.45320000000000005,"{""sentence_position"": 5, ""text_length"": 321, ""has_question"": true, ""word_count"": 45, ""complexity_score"": 0.9155555555555557}"
4c7025ad-a1ab-4e20-a9e9-dad89fc9ac28,4,1,2025-08-03T17:53:30.869768,1754261610.869768,How do different user groups interact in a community center?,ideation,analysis,text,student,0.056100000000000004,"{""sentence_position"": 0, ""text_length"": 60, ""has_question"": true, ""word_count"": 10, ""complexity_score"": 0.51}"
4c7025ad-a1ab-4e20-a9e9-dad89fc9ac28,4,1,2025-08-03T17:53:30.969768,1754261610.969768,"When considering how different user groups interact in a community center, especially one that serves as a hub for education and community events, it's important to think about the diverse needs and dynamics of these groups.",ideation,analysis,text,agent,0.2871,"{""sentence_position"": 0, ""text_length"": 224, ""has_question"": false, ""word_count"": 36, ""complexity_score"": 0.7250000000000001}"
4c7025ad-a1ab-4e20-a9e9-dad89fc9ac28,4,2,2025-08-03T17:53:31.069768,1754261611.069768,"Imagine the various user groups: children, teenagers, adults, and seniors.",ideation,general,text,agent,0.1,"{""sentence_position"": 1, ""text_length"": 74, ""has_question"": false, ""word_count"": 10, ""complexity_score"": 1.0}"
4c7025ad-a1ab-4e20-a9e9-dad89fc9ac28,4,3,2025-08-03T17:53:31.169768,1754261611.169768,Each group has unique needs and preferences.,ideation,analysis,text,agent,0.04180000000000001,"{""sentence_position"": 2, ""text_length"": 44, ""has_question"": false, ""word_count"": 7, ""complexity_score"": 0.5428571428571429}"
4c7025ad-a1ab-4e20-a9e9-dad89fc9ac28,4,4,2025-08-03T17:53:31.269768,1754261611.269768,"For instance, children might require safe, stimulating environments, while teenagers might look for spaces that offer autonomy and social interaction.",ideation,general,text,agent,0.191,"{""sentence_position"": 3, ""text_length"": 150, ""has_question"": false, ""word_count"": 20, ""complexity_score"": 0.9550000000000001}"
4c7025ad-a1ab-4e20-a9e9-dad89fc9ac28,4,5,2025-08-03T17:53:31.369768,1754261611.369768,"Adults might prioritize functional spaces for workshops, and seniors might need accessible, quiet areas for reading or socializing.",ideation,general,text,agent,0.15,"{""sentence_position"": 4, ""text_length"": 131, ""has_question"": false, ""word_count"": 18, ""complexity_score"": 0.8333333333333333}"
4c7025ad-a1ab-4e20-a9e9-dad89fc9ac28,4,6,2025-08-03T17:53:31.469768,1754261611.469768,"Now, think about how these groups might interact.",ideation,analysis,text,agent,0.05500000000000001,"{""sentence_position"": 5, ""text_length"": 49, ""has_question"": false, ""word_count"": 8, ""complexity_score"": 0.625}"
4c7025ad-a1ab-4e20-a9e9-dad89fc9ac28,4,7,2025-08-03T17:53:31.569768,1754261611.569768,Could shared spaces foster intergenerational learning and community bonding?,ideation,general,text,agent,0.068,"{""sentence_position"": 6, ""text_length"": 76, ""has_question"": true, ""word_count"": 9, ""complexity_score"": 0.7555555555555555}"
4c7025ad-a1ab-4e20-a9e9-dad89fc9ac28,4,8,2025-08-03T17:53:31.669768,1754261611.669768,Or might they create conflicts over space usage and noise levels?,ideation,general,text,agent,0.055,"{""sentence_position"": 7, ""text_length"": 65, ""has_question"": true, ""word_count"": 11, ""complexity_score"": 0.5}"
4c7025ad-a1ab-4e20-a9e9-dad89fc9ac28,4,9,2025-08-03T17:53:31.769768,1754261611.769768,Consider the trade-offs between designing flexible multipurpose spaces versus dedicated areas for specific activities.,ideation,analysis,text,agent,0.1155,"{""sentence_position"": 8, ""text_length"": 118, ""has_question"": false, ""word_count"": 14, ""complexity_score"": 0.75}"
4c7025ad-a1ab-4e20-a9e9-dad89fc9ac28,4,10,2025-08-03T17:53:31.869768,1754261611.869768,"In your project, how might the layout of classrooms, libraries, and outdoor areas facilitate or hinder these interactions?",ideation,analysis,text,agent,0.1749,"{""sentence_position"": 9, ""text_length"": 122, ""has_question"": true, ""word_count"": 18, ""complexity_score"": 0.8833333333333333}"
4c7025ad-a1ab-4e20-a9e9-dad89fc9ac28,4,11,2025-08-03T17:53:31.969768,1754261611.969768,Could transparent partitions or movable walls offer flexibility while maintaining a sense of openness?,ideation,general,text,agent,0.08899999999999998,"{""sentence_position"": 10, ""text_length"": 102, ""has_question"": true, ""word_count"": 14, ""complexity_score"": 0.6357142857142857}"
4c7025ad-a1ab-4e20-a9e9-dad89fc9ac28,4,12,2025-08-03T17:53:32.069768,1754261612.069768,How might circulation,ideation,analysis,text,agent,0.020900000000000002,"{""sentence_position"": 11, ""text_length"": 21, ""has_question"": false, ""word_count"": 3, ""complexity_score"": 0.6333333333333333}"
4c7025ad-a1ab-4e20-a9e9-dad89fc9ac28,4,13,2025-08-03T17:53:32.169768,1754261612.169768,"What aspects of designing flexible multipurpose spaces, as mentioned in the examples, do you find most compelling for your community center project, and how might these spaces address the diverse needs and interactions of different user groups like children, teenagers, adults, and seniors?",ideation,analysis,text,agent,0.47300000000000003,"{""sentence_position"": 12, ""text_length"": 290, ""has_question"": true, ""word_count"": 43, ""complexity_score"": 1.0}"
4c7025ad-a1ab-4e20-a9e9-dad89fc9ac28,5,1,2025-08-03T17:54:11.027673,1754261651.027673,What are the spatial relationships between functions?,ideation,general,text,student,0.047,"{""sentence_position"": 0, ""text_length"": 53, ""has_question"": true, ""word_count"": 7, ""complexity_score"": 0.6714285714285715}"
4c7025ad-a1ab-4e20-a9e9-dad89fc9ac28,5,1,2025-08-03T17:54:11.127673,1754261651.127673,"I hear your question about spatial relationships between functions, and it's a pivotal one for your community learning center project.",ideation,general,text,agent,0.13499999999999998,"{""sentence_position"": 0, ""text_length"": 134, ""has_question"": false, ""word_count"": 20, ""complexity_score"": 0.6749999999999999}"
4c7025ad-a1ab-4e20-a9e9-dad89fc9ac28,5,2,2025-08-03T17:54:11.227673,1754261651.227673,Delving into these relationships is crucial because they determine how effectively your spaces can serve diverse educational and communal needs.,ideation,evaluation,text,agent,0.1625,"{""sentence_position"": 1, ""text_length"": 144, ""has_question"": false, ""word_count"": 20, ""complexity_score"": 0.625}"
4c7025ad-a1ab-4e20-a9e9-dad89fc9ac28,5,3,2025-08-03T17:54:11.327673,1754261651.327673,Think of it as creating a symphony where each space harmonizes to enhance learning and interaction.,ideation,general,text,agent,0.084,"{""sentence_position"": 2, ""text_length"": 99, ""has_question"": false, ""word_count"": 16, ""complexity_score"": 0.525}"
4c7025ad-a1ab-4e20-a9e9-dad89fc9ac28,5,4,2025-08-03T17:54:11.427673,1754261651.427673,"With classrooms, a library, multipurpose spaces, and outdoor areas, consider: How can you strategically position each function to facilitate natural flow and interaction, ensuring accessibility and inclusivity for all ages?",ideation,analysis,text,agent,0.33,"{""sentence_position"": 3, ""text_length"": 223, ""has_question"": true, ""word_count"": 30, ""complexity_score"": 1.0}"
4c7025ad-a1ab-4e20-a9e9-dad89fc9ac28,5,5,2025-08-03T17:54:11.527673,1754261651.527673,Visualize how a student or community member moves through the building and how each space supports both,ideation,analysis,text,agent,0.09570000000000001,"{""sentence_position"": 4, ""text_length"": 103, ""has_question"": false, ""word_count"": 17, ""complexity_score"": 0.5117647058823529}"
4c7025ad-a1ab-4e20-a9e9-dad89fc9ac28,5,6,2025-08-03T17:54:11.627673,1754261651.627673,"What aspects of the spatial relationships in the example of a community learning center, where each space harmonizes like a symphony to enhance learning and interaction, do you find most compelling for your project?",ideation,analysis,text,agent,0.275,"{""sentence_position"": 5, ""text_length"": 215, ""has_question"": true, ""word_count"": 34, ""complexity_score"": 0.7352941176470589}"
4c7025ad-a1ab-4e20-a9e9-dad89fc9ac28,5,7,2025-08-03T17:54:11.727673,1754261651.727673,Why do you think these elements could be effectively applied to ensure accessibility and inclusivity in your own design?,ideation,analysis,text,agent,0.11220000000000001,"{""sentence_position"": 6, ""text_length"": 120, ""has_question"": true, ""word_count"": 19, ""complexity_score"": 0.5368421052631579}"
4c7025ad-a1ab-4e20-a9e9-dad89fc9ac28,6,1,2025-08-03T17:54:43.676104,1754261683.676104,What construction system should I use for this community center?,unknown,general,text,student,0.055,"{""sentence_position"": 0, ""text_length"": 64, ""has_question"": true, ""word_count"": 10, ""complexity_score"": 0.55}"
4c7025ad-a1ab-4e20-a9e9-dad89fc9ac28,6,1,2025-08-03T17:54:43.776104,1754261683.776104,"Considering the unique needs of your community center project, how might the choice of a construction system not only impact the building's functionality and sustainability but also enhance the sense of belonging and interaction among community members?",unknown,analysis,text,agent,0.27940000000000004,"{""sentence_position"": 0, ""text_length"": 253, ""has_question"": true, ""word_count"": 37, ""complexity_score"": 0.6864864864864865}"
4c7025ad-a1ab-4e20-a9e9-dad89fc9ac28,7,1,2025-08-03T17:56:05.881225,1754261765.881225,i think using steel structures and brick infill would make for a building that fits contextually and harmoniously fits into its surrounding.,materialization,transformation,text,student,0.21658,"{""sentence_position"": 0, ""text_length"": 140, ""has_question"": false, ""word_count"": 22, ""complexity_score"": 0.5409090909090909}"
4c7025ad-a1ab-4e20-a9e9-dad89fc9ac28,7,1,2025-08-03T17:56:05.981225,1754261765.981225,"Looking at the example of using steel structures with brick infill, what underlying principles about structural integrity and thermal efficiency can you identify, and how might these principles specifically inform the design choices for your community learning center in terms of both functionality and aesthetic integration with the local architectural style?",materialization,transformation,text,agent,0.74984,"{""sentence_position"": 0, ""text_length"": 360, ""has_question"": true, ""word_count"": 51, ""complexity_score"": 0.807843137254902}"
