move_id,session_id,timestamp,sequence_number,content,move_type,phase,modality,cognitive_operation,design_focus,move_source,cognitive_load,previous_move_id,tool_used,interaction_trigger,semantic_links,temporal_links,conceptual_distance,ai_influence_strength,self_generation_strength,directness_level,pause_duration,revision_count,complexity_score,uncertainty_markers
7abc8a36-0f78-4327-a821-ac6795cdbc24,4c6d62c5-04ce-4870-afc2-bfe5bfb8e954,2025-08-06T15:00:15.092168,1,I need your help defining the program of a community center,analysis,IDEATION,text,proposal,function,user_generated,medium,,,,[],[],0.0,,1.0,,0.0,0,0.3982575757575757,0
10185ea0-adef-4cbe-86cf-68653d0cc49a,4c6d62c5-04ce-4870-afc2-bfe5bfb8e954,2025-08-06T15:00:15.100170,2,"Considering the unique needs of the community you're designing for, how might the program of your community center reflect and enhance the cultural, social, and recreational activities that are most valued by its members?",analysis,IDEATION,text,proposal,culture,ai_prompted,medium,,,,[],[],0.0,,1.0,,0.0,0,0.7112745098039215,1
af4c7d89-56da-40e0-8111-e9d01471b59c,4c6d62c5-04ce-4870-afc2-bfe5bfb8e954,2025-08-06T15:01:06.928277,3,"well, this is for a Chinese community",analysis,IDEATION,text,proposal,culture,user_generated,medium,,,,[],[],0.0,,1.0,,0.0,0,0.42654761904761906,0
1e86116f-87ee-4015-b023-4f982db59cf6,4c6d62c5-04ce-4870-afc2-bfe5bfb8e954,2025-08-06T15:01:06.960329,4,"When designing a community center for a Chinese community, it's essential to consider the cultural, social, and functional aspects that will shape the programming of the space.",analysis,IDEATION,text,proposal,function,ai_prompted,medium,,,,[],[],0.0,,1.0,,0.0,0,0.6931481481481481,0
c5badc8e-272c-4f23-bc51-6c76751a616a,4c6d62c5-04ce-4870-afc2-bfe5bfb8e954,2025-08-06T15:01:06.960329,5,**Cultural Significance and Traditions**: Chinese communities often have rich cultural traditions that could influence the design of a community center.,analysis,IDEATION,text,proposal,culture,ai_prompted,medium,,,,[],[],0.0,,1.0,,0.0,0,0.6160416666666666,1
6ece50bc-4b84-42e6-9e16-b7333a4b3735,4c6d62c5-04ce-4870-afc2-bfe5bfb8e954,2025-08-06T15:01:06.960329,6,How might these cultural activities influence the spatial layout and design elements of your project?,reflection,IDEATION,text,proposal,material,ai_prompted,low,,,,[],[],0.0,,1.0,,0.0,0,0.5141666666666667,1
a7ad13cc-3105-4417-8a5e-ca7dd2fa3e37,4c6d62c5-04ce-4870-afc2-bfe5bfb8e954,2025-08-06T15:01:06.960329,7,2. **Social Dynamics and Inclusivity**: Community centers serve as gathering places for people of all ages and backgrounds.,analysis,IDEATION,text,proposal,culture,ai_prompted,medium,,,,[],[],0.0,,1.0,,0.0,0,0.5452777777777779,0
a3d84d9e-a8c1-42c6-b394-acafc65fe3a8,4c6d62c5-04ce-4870-afc2-bfe5bfb8e954,2025-08-06T15:01:06.960329,8,"In a Chinese community, there might be a need for spaces that cater to both traditional family structures and modern social interactions.",analysis,IDEATION,text,proposal,culture,ai_prompted,medium,,,,[],[],0.0,,1.0,,0.0,0,0.5965151515151516,1
21258e59-3a6e-4244-ba46-49d6387ac849,4c6d62c5-04ce-4870-afc2-bfe5bfb8e954,2025-08-06T15:01:06.961336,9,"How can you design flexible spaces that accommodate diverse activities and foster a sense of belonging for all community members?

3.",analysis,IDEATION,text,proposal,culture,ai_prompted,medium,,,,[],[],0.0,,1.0,,0.0,0,0.5433333333333333,0
240c1bd0-0340-4e62-8489-36c1f9270165,4c6d62c5-04ce-4870-afc2-bfe5bfb8e954,2025-08-06T15:01:06.961336,10,**Functional Requirements and Adaptability**: Consider the types of activities and services the community center will host.,analysis,IDEATION,text,proposal,function,ai_prompted,medium,,,,[],[],0.0,,1.0,,0.0,0,0.5672916666666666,0
07432347-88fb-4513-874a-607fbc424021,4c6d62c5-04ce-4870-afc2-bfe5bfb8e954,2025-08-06T15:01:06.961336,11,"Will it include

Looking at the example of incorporating spaces for tai chi, calligraphy, or tea ceremonies in the design of a community center, what underlying principles about cultural significance and spatial layout can you identify, and how might these principles guide you in creating a design that respects and enhances the cultural traditions of the Chinese community you are working with?",reflection,IDEATION,text,proposal,culture,ai_prompted,low,,,,[],[],0.0,,1.0,,0.0,0,0.7095430107526881,1
932fb975-8c66-4812-a4e9-67e046646665,4c6d62c5-04ce-4870-afc2-bfe5bfb8e954,2025-08-06T15:01:57.967848,12,"I don't know anything about Chinese culture, so I need your help defining the most appropiate program so is culturally sensitive",analysis,IDEATION,text,proposal,function,user_generated,medium,,,,[],[],0.0,,1.0,,0.0,0,0.6123809523809524,1
8fb6ca55-60d1-4269-9f75-f907991b751c,4c6d62c5-04ce-4870-afc2-bfe5bfb8e954,2025-08-06T15:01:57.977399,13,"Given your interest in creating a culturally sensitive community space without prior knowledge of Chinese culture, how might you engage with local Chinese communities to discover which cultural elements are most significant to them and how these could inspire an authentic architectural program for your project?",reflection,IDEATION,text,proposal,culture,ai_prompted,low,,,,[],[],0.0,,1.0,,0.0,0,0.7379528985507247,2
837f5aac-9cb2-4f47-b693-a9bbca6eb1aa,4c6d62c5-04ce-4870-afc2-bfe5bfb8e954,2025-08-06T15:02:37.482094,14,"I can't engage with them because I won't have the chance, so I need your help instead",analysis,IDEATION,text,proposal,function,user_generated,medium,,,,[],[],0.0,,1.0,,0.0,0,0.5574999999999999,0
f6da31f4-4c7b-4fa3-ad35-0b1712799e80,4c6d62c5-04ce-4870-afc2-bfe5bfb8e954,2025-08-06T15:02:37.489993,15,"How might you design a community space that fosters engagement and interaction, even when direct communication with the community isn't possible, and how could architectural elements like layout, materials, or lighting play a role in this?",reflection,IDEATION,text,proposal,material,ai_prompted,low,,,,[],[],0.0,,1.0,,0.0,0,0.7124999999999999,2
448cb62d-648d-4464-80db-18340def7efe,4c6d62c5-04ce-4870-afc2-bfe5bfb8e954,2025-08-06T15:03:13.358509,16,"don't ask me more questions, I need answers",analysis,IDEATION,text,proposal,function,user_generated,medium,,,,[],[],0.0,,1.0,,0.0,0,0.43208333333333326,1
cbe0f6d4-8393-4e3f-bbc6-95da168d4b9d,4c6d62c5-04ce-4870-afc2-bfe5bfb8e954,2025-08-06T15:03:13.366953,17,"I understand you’re seeking clarity, but if we consider the essence of your community project, how might embracing the complexity of multiple perspectives lead to a design that truly serves and unites its users?",analysis,IDEATION,text,proposal,function,ai_prompted,medium,,,,[],[],0.0,,1.0,,0.0,0,0.6943627450980392,1
fe580586-7f1c-4d2f-8df9-288422e5f06d,4c6d62c5-04ce-4870-afc2-bfe5bfb8e954,2025-08-06T15:04:14.987018,18,"Now I need your help visualizing the building, how would it traditionally look like?",synthesis,VISUALIZATION,text,proposal,form,user_generated,high,,,,[],[],0.0,,1.0,,0.0,0,0.5063690476190477,0
34b6260d-d73e-487c-808a-822cd15bd506,4c6d62c5-04ce-4870-afc2-bfe5bfb8e954,2025-08-06T15:04:14.994412,19,How might you incorporate traditional architectural elements into your community building design while also ensuring it meets the unique needs and cultural identity of the local community?,synthesis,VISUALIZATION,text,proposal,culture,ai_prompted,high,,,,[],[],0.0,,1.0,,0.0,0,0.7024074074074074,1
af8eda97-7196-4f88-ac14-b5fcea3c3c95,4c6d62c5-04ce-4870-afc2-bfe5bfb8e954,2025-08-06T15:04:51.568975,20,You cannot answer all of my questions qith another question buddy,analysis,VISUALIZATION,text,proposal,function,user_generated,medium,,,,[],[],0.0,,1.0,,0.0,0,0.4187121212121212,1
ddce17ad-f8db-49db-9406-a85dc7892933,4c6d62c5-04ce-4870-afc2-bfe5bfb8e954,2025-08-06T15:04:51.578079,21,"Let's dive deeper into your community project: How can the design elements you've chosen foster a sense of belonging and interaction among community members, while also addressing any specific challenges or needs you've identified in your project?",reflection,VISUALIZATION,text,proposal,material,ai_prompted,low,,,,[],[],0.0,,1.0,,0.0,0,0.7787162162162162,0
f873d19b-1c36-4e38-a1ef-ab3bd7ff3238,4c6d62c5-04ce-4870-afc2-bfe5bfb8e954,2025-08-06T15:06:04.039572,22,"Ok, so far you've been very unhelpful, let's see if you do better helping me define the construction system for this building, it will be located in san francisco",synthesis,MATERIALIZATION,text,clarification,structure,user_generated,high,,,,[],[],0.0,,1.0,,0.0,0,0.6379885057471264,0
ad0cd5dc-3ac4-45c4-9954-d13519ab558d,4c6d62c5-04ce-4870-afc2-bfe5bfb8e954,2025-08-06T15:06:04.045470,23,"Given the diverse community in San Francisco and its unique seismic challenges, how might you approach selecting a construction system that not only ensures structural safety but also fosters a sense of inclusivity and engagement for the local community?",reflection,MATERIALIZATION,text,proposal,structure,ai_prompted,low,,,,[],[],0.0,,1.0,,0.0,0,0.7128205128205127,1
